### ISSUE TITLE
babel-mesh requires igmp_snooping = 0 on br-client

### ISSUE THREAD

**Issue by christf** [freifunk-gluon/gluon#959]
This issue is to drive the analysis of the issue and track the progress on getting a babel mesh with l3roamd to work properly with igmp_snooping on br-client.

@T_X let us not run the analysis inside the PR #934, let us instead run this here.
@rotanid, would you please assign this issue to me?

**Comment by christf** [comment]
This dump was taken with igmp_snooping=1 it took more than 30 seconds before the first traffic even did show up on the bridge. It took a long time before the client actually grabbed an IP address

`
./tcpdump  -p -i br-client
tcpdump: WARNING: br-client: no IPv4 address assigned
tcpdump: verbose output suppressed, use -v or -vv for full protocol decode
listening on br-client, link-type EN10MB (Ethernet), capture size 65535 bytes



[ 1542.240000] eth0: link up (1000Mbps/Full duplex)
[ 1542.240000] br-client: port 1(eth0) entered forwarding state
[ 1542.250000] br-client: port 1(eth0) entered forwarding state
[ 1544.250000] br-client: port 1(eth0) entered forwarding state
[ 1555.520000] REJECT(dest wan)IN= OUT=br-wan SRC=fe80:0000:0000:0000:6670:02ff:febb:db01 DST=ff02:0000:0000:0000:0000:0000:0000:0002 LEN=72 TC=0 HOPLIMIT=1 FLOWLBL=0 PROTO=ICMPv6 TYPE=131 CODE=0 
[ 1557.020000] REJECT(dest wan)IN= OUT=br-wan SRC=fe80:0000:0000:0000:6670:02ff:febb:db01 DST=ff02:0000:0000:0000:0000:0001:ffbb:db01 LEN=72 TC=0 HOPLIMIT=1 FLOWLBL=0 PROTO=ICMPv6 TYPE=131 CODE=0 
[ 1557.160000] REJECT(dest wan)IN= OUT=br-wan SRC=fe80:0000:0000:0000:6670:02ff:febb:db01 DST=ff02:0000:0000:0000:0000:0001:ff00:0000 LEN=72 TC=0 HOPLIMIT=1 FLOWLBL=0 PROTO=ICMPv6 TYPE=131 CODE=0 






13:41:05.733038 IP6 fe80::1441:95ff:fe40:f7dc > ff02::1: ICMP6, router advertisement, length 80
13:41:06.782382 IP6 fe80::9eeb:e8ff:fe20:92a2.42913 > nextnode.domain: 55057+ SOA? local. (23)
13:41:06.848918 IP6 nextnode.domain > fe80::9eeb:e8ff:fe20:92a2.42913: 55057 NXDomain 0/1/0 (98)
13:41:09.332006 IP6 2a06:8187:fbab:2:9eeb:e8ff:fe20:92a2.44965 > ber01s14-in-x04.1e100.net.https: UDP, length 1350
13:41:09.332485 IP6 2a06:8187:fbab:2:9eeb:e8ff:fe20:92a2.59668 > ber01s14-in-x04.1e100.net.https: Flags [S], seq 1628829021, win 28800, options [mss 1440,sackOK,TS val 35654980 ecr 0,nop,wscale 7], length 0
13:41:09.332735 IP6 2a06:8187:fbab:2:9eeb:e8ff:fe20:92a2.44965 > ber01s14-in-x04.1e100.net.https: UDP, length 228
13:41:09.333863 IP6 fe80::1441:95ff:fe40:f7dc > ff02::1:ff20:92a2: ICMP6, neighbor solicitation, who has 2a06:8187:fbab:2:9eeb:e8ff:fe20:92a2, length 32
13:41:09.334245 IP6 2a06:8187:fbab:2:9eeb:e8ff:fe20:92a2 > fe80::1441:95ff:fe40:f7dc: ICMP6, neighbor advertisement, tgt is 2a06:8187:fbab:2:9eeb:e8ff:fe20:92a2, length 32
13:41:09.337145 IP6 nextnode > 2a06:8187:fbab:2:9eeb:e8ff:fe20:92a2: ICMP6, packet too big, mtu 1312, length 1240
13:41:09.341732 IP6 2a06:8187:fbab:2:9eeb:e8ff:fe20:92a2.42079 > ber01s14-in-x04.1e100.net.https: UDP, length 1350
13:41:09.342031 IP6 nextnode > 2a06:8187:fbab:2:9eeb:e8ff:fe20:92a2: ICMP6, packet too big, mtu 1312, length 1240
13:41:09.501017 IP6 2a06:8187:fbab:2:9eeb:e8ff:fe20:92a2.59670 > ber01s14-in-x04.1e100.net.https: Flags [S], seq 3106298234, win 28800, options [mss 1440,sackOK,TS val 35655022 ecr 0,nop,wscale 7], length 0
13:41:09.652875 IP6 2a06:8187:fbab:2:9eeb:e8ff:fe20:92a2.59674 > ber01s14-in-x04.1e100.net.https: Flags [S], seq 412087977, win 28800, options [mss 1440,sackOK,TS val 35655060 ecr 0,nop,wscale 7], length 0
13:41:11.795110 IP6 fe80::9eeb:e8ff:fe20:92a2 > fe80::1441:95ff:fe40:f7dc: ICMP6, neighbor solicitation, who has fe80::1441:95ff:fe40:f7dc, length 32
13:41:11.795357 IP6 fe80::1441:95ff:fe40:f7dc > fe80::9eeb:e8ff:fe20:92a2: ICMP6, neighbor advertisement, tgt is fe80::1441:95ff:fe40:f7dc, length 24
13:41:11.852737 IP6 fe80::1441:95ff:fe40:f7dc > fe80::9eeb:e8ff:fe20:92a2: ICMP6, neighbor solicitation, who has fe80::9eeb:e8ff:fe20:92a2, length 32
13:41:11.853123 IP6 fe80::9eeb:e8ff:fe20:92a2 > fe80::1441:95ff:fe40:f7dc: ICMP6, neighbor advertisement, tgt is fe80::9eeb:e8ff:fe20:92a2, length 24
13:41:11.991197 IP6 fe80::1441:95ff:fe40:f7dc > ff02::1:ff20:92a2: ICMP6, neighbor solicitation, who has 2a06:8187:fbab:2:9eeb:e8ff:fe20:92a2, length 32
13:41:11.991613 IP6 2a06:8187:fbab:2:9eeb:e8ff:fe20:92a2 > fe80::1441:95ff:fe40:f7dc: ICMP6, neighbor advertisement, tgt is 2a06:8187:fbab:2:9eeb:e8ff:fe20:92a2, length 32
13:41:15.702525 IP6 ber01s14-in-x04.1e100.net.https > 2a06:8187:fbab:2:9eeb:e8ff:fe20:92a2.59668: Flags [S.], seq 45665851, ack 1628829022, win 27960, options [mss 1410,sackOK,TS val 2581628569 ecr 35654980,nop,wscale 7], length 0
13:41:15.703023 IP6 2a06:8187:fbab:2:9eeb:e8ff:fe20:92a2.59668 > ber01s14-in-x04.1e100.net.https: Flags [R], seq 1628829022, win 0, length 0
13:41:15.872143 IP6 ber01s14-in-x04.1e100.net.https > 2a06:8187:fbab:2:9eeb:e8ff:fe20:92a2.59670: Flags [S.], seq 252324407, ack 3106298235, win 27960, options [mss 1410,sackOK,TS val 2754297122 ecr 35655022,nop,wscale 7], length 0
13:41:15.872692 IP6 2a06:8187:fbab:2:9eeb:e8ff:fe20:92a2.59670 > ber01s14-in-x04.1e100.net.https: Flags [R], seq 3106298235, win 0, length 0
13:41:16.025444 IP6 ber01s14-in-x04.1e100.net.https > 2a06:8187:fbab:2:9eeb:e8ff:fe20:92a2.59674: Flags [S.], seq 1318652282, ack 412087978, win 27960, options [mss 1410,sackOK,TS val 2668017736 ecr 35655060,nop,wscale 7], length 0
13:41:16.025805 IP6 2a06:8187:fbab:2:9eeb:e8ff:fe20:92a2.59674 > ber01s14-in-x04.1e100.net.https: Flags [R], seq 412087978, win 0, length 0
13:41:16.992036 IP6 fe80::1441:95ff:fe40:f7dc > ff02::1:ff20:92a2: ICMP6, neighbor solicitation, who has 2a06:8187:fbab:2:9eeb:e8ff:fe20:92a2, length 32
13:41:16.992526 IP6 2a06:8187:fbab:2:9eeb:e8ff:fe20:92a2 > fe80::1441:95ff:fe40:f7dc: ICMP6, neighbor advertisement, tgt is 2a06:8187:fbab:2:9eeb:e8ff:fe20:92a2, length 32
13:41:21.995890 IP6 fe80::1441:95ff:fe40:f7dc > ff02::1:ff20:92a2: ICMP6, neighbor solicitation, who has 2a06:8187:fbab:2:9eeb:e8ff:fe20:92a2, length 32
13:41:21.996279 IP6 2a06:8187:fbab:2:9eeb:e8ff:fe20:92a2 > fe80::1441:95ff:fe40:f7dc: ICMP6, neighbor advertisement, tgt is 2a06:8187:fbab:2:9eeb:e8ff:fe20:92a2, length 32
13:41:26.996733 IP6 fe80::1441:95ff:fe40:f7dc > ff02::1:ff20:92a2: ICMP6, neighbor solicitation, who has 2a06:8187:fbab:2:9eeb:e8ff:fe20:92a2, length 32
13:41:26.997127 IP6 2a06:8187:fbab:2:9eeb:e8ff:fe20:92a2 > fe80::1441:95ff:fe40:f7dc: ICMP6, neighbor advertisement, tgt is 2a06:8187:fbab:2:9eeb:e8ff:fe20:92a2, length 32
13:41:31.997547 IP6 fe80::1441:95ff:fe40:f7dc > ff02::1:ff20:92a2: ICMP6, neighbor solicitation, who has 2a06:8187:fbab:2:9eeb:e8ff:fe20:92a2, length 32
13:41:31.997949 IP6 2a06:8187:fbab:2:9eeb:e8ff:fe20:92a2 > fe80::1441:95ff:fe40:f7dc: ICMP6, neighbor advertisement, tgt is 2a06:8187:fbab:2:9eeb:e8ff:fe20:92a2, length 32
[ 1640.800000] REJECT(src client)IN=br-client OUT= MAC=01:00:5e:00:00:01:16:41:95:40:f7:dc:08:00 SRC=0.0.0.0 DST=224.0.0.1 LEN=32 TOS=0x00 PREC=0xC0 TTL=1 ID=0 DF PROTO=2 
[ 1640.810000] REJECT(src client)IN=br-client OUT= MAC=33:33:00:00:00:01:16:41:95:40:f7:dc:86:dd SRC=fe80:0000:0000:0000:1441:95ff:fe40:f7dc DST=ff02:0000:0000:0000:0000:0000:0000:0001 LEN=72 TC=0 HOPLIMIT=1 FLOWLBL=0 PROTO=ICMPv6 TYPE=130 CODE=0 
13:41:35.242710 IP 0.0.0.0 > all-systems.mcast.net: igmp query v2
13:41:35.256556 IP6 fe80::1441:95ff:fe40:f7dc > ff02::1: HBH ICMP6, multicast listener querymax resp delay: 10000 addr: ::, length 24
13:41:36.998384 IP6 fe80::1441:95ff:fe40:f7dc > ff02::1:ff20:92a2: ICMP6, neighbor solicitation, who has 2a06:8187:fbab:2:9eeb:e8ff:fe20:92a2, length 32
13:41:36.998779 IP6 2a06:8187:fbab:2:9eeb:e8ff:fe20:92a2 > fe80::1441:95ff:fe40:f7dc: ICMP6, neighbor advertisement, tgt is 2a06:8187:fbab:2:9eeb:e8ff:fe20:92a2, length 32
13:41:41.999192 IP6 fe80::1441:95ff:fe40:f7dc > ff02::1:ff20:92a2: ICMP6, neighbor solicitation, who has 2a06:8187:fbab:2:9eeb:e8ff:fe20:92a2, length 32
13:41:41.999602 IP6 2a06:8187:fbab:2:9eeb:e8ff:fe20:92a2 > fe80::1441:95ff:fe40:f7dc: ICMP6, neighbor advertisement, tgt is 2a06:8187:fbab:2:9eeb:e8ff:fe20:92a2, length 32
13:41:47.000005 IP6 fe80::1441:95ff:fe40:f7dc > ff02::1:ff20:92a2: ICMP6, neighbor solicitation, who has 2a06:8187:fbab:2:9eeb:e8ff:fe20:92a2, length 32
13:41:47.000408 IP6 2a06:8187:fbab:2:9eeb:e8ff:fe20:92a2 > fe80::1441:95ff:fe40:f7dc: ICMP6, neighbor advertisement, tgt is 2a06:8187:fbab:2:9eeb:e8ff:fe20:92a2, length 32
13:41:52.000979 IP6 fe80::1441:95ff:fe40:f7dc > ff02::1:ff20:92a2: ICMP6, neighbor solicitation, who has 2a06:8187:fbab:2:9eeb:e8ff:fe20:92a2, length 32
13:41:52.001374 IP6 2a06:8187:fbab:2:9eeb:e8ff:fe20:92a2 > fe80::1441:95ff:fe40:f7dc: ICMP6, neighbor advertisement, tgt is 2a06:8187:fbab:2:9eeb:e8ff:fe20:92a2, length 32
13:41:57.001795 IP6 fe80::1441:95ff:fe40:f7dc > ff02::1:ff20:92a2: ICMP6, neighbor solicitation, who has 2a06:8187:fbab:2:9eeb:e8ff:fe20:92a2, length 32
13:41:57.002184 IP6 2a06:8187:fbab:2:9eeb:e8ff:fe20:92a2 > fe80::1441:95ff:fe40:f7dc: ICMP6, neighbor advertisement, tgt is 2a06:8187:fbab:2:9eeb:e8ff:fe20:92a2, length 32
13:41:57.010986 IP6 fe80::9eeb:e8ff:fe20:92a2 > fe80::1441:95ff:fe40:f7dc: ICMP6, neighbor solicitation, who has fe80::1441:95ff:fe40:f7dc, length 32
13:41:57.011239 IP6 fe80::1441:95ff:fe40:f7dc > fe80::9eeb:e8ff:fe20:92a2: ICMP6, neighbor advertisement, tgt is fe80::1441:95ff:fe40:f7dc, length 24
13:42:02.002667 IP6 fe80::1441:95ff:fe40:f7dc > ff02::1:ff20:92a2: ICMP6, neighbor solicitation, who has 2a06:8187:fbab:2:9eeb:e8ff:fe20:92a2, length 32
13:42:02.003060 IP6 2a06:8187:fbab:2:9eeb:e8ff:fe20:92a2 > fe80::1441:95ff:fe40:f7dc: ICMP6, neighbor advertisement, tgt is 2a06:8187:fbab:2:9eeb:e8ff:fe20:92a2, length 32
13:42:02.012755 IP6 fe80::1441:95ff:fe40:f7dc > fe80::9eeb:e8ff:fe20:92a2: ICMP6, neighbor solicitation, who has fe80::9eeb:e8ff:fe20:92a2, length 32
13:42:02.013204 IP6 fe80::9eeb:e8ff:fe20:92a2 > fe80::1441:95ff:fe40:f7dc: ICMP6, neighbor advertisement, tgt is fe80::9eeb:e8ff:fe20:92a2, length 24
13:42:07.004836 IP6 fe80::1441:95ff:fe40:f7dc > ff02::1:ff20:92a2: ICMP6, neighbor solicitation, who has 2a06:8187:fbab:2:9eeb:e8ff:fe20:92a2, length 32
13:42:07.005231 IP6 2a06:8187:fbab:2:9eeb:e8ff:fe20:92a2 > fe80::1441:95ff:fe40:f7dc: ICMP6, neighbor advertisement, tgt is 2a06:8187:fbab:2:9eeb:e8ff:fe20:92a2, length 32
[ 1674.490000] REJECT(dest wan)IN= OUT=br-wan SRC=fe80:0000:0000:0000:6670:02ff:febb:db01 DST=ff02:0000:0000:0000:0000:0001:ff00:0000 LEN=72 TC=0 HOPLIMIT=1 FLOWLBL=0 PROTO=ICMPv6 TYPE=131 CODE=0 
13:42:12.005646 IP6 fe80::1441:95ff:fe40:f7dc > ff02::1:ff20:92a2: ICMP6, neighbor solicitation, who has 2a06:8187:fbab:2:9eeb:e8ff:fe20:92a2, length 32
13:42:12.006045 IP6 2a06:8187:fbab:2:9eeb:e8ff:fe20:92a2 > fe80::1441:95ff:fe40:f7dc: ICMP6, neighbor advertisement, tgt is 2a06:8187:fbab:2:9eeb:e8ff:fe20:92a2, length 32
[ 1679.700000] REJECT(dest wan)IN= OUT=br-wan SRC=fe80:0000:0000:0000:6670:02ff:febb:db01 DST=ff02:0000:0000:0000:0000:0001:ffbb:db01 LEN=72 TC=0 HOPLIMIT=1 FLOWLBL=0 PROTO=ICMPv6 TYPE=131 CODE=0 
[ 1680.800000] REJECT(dest wan)IN= OUT=br-wan SRC=fe80:0000:0000:0000:6670:02ff:febb:db01 DST=ff02:0000:0000:0000:0000:0000:0000:0002 LEN=72 TC=0 HOPLIMIT=1 FLOWLBL=0 PROTO=ICMPv6 TYPE=131 CODE=0 
13:42:17.006469 IP6 fe80::1441:95ff:fe40:f7dc > ff02::1:ff20:92a2: ICMP6, neighbor solicitation, who has 2a06:8187:fbab:2:9eeb:e8ff:fe20:92a2, length 32
13:42:17.006882 IP6 2a06:8187:fbab:2:9eeb:e8ff:fe20:92a2 > fe80::1441:95ff:fe40:f7dc: ICMP6, neighbor advertisement, tgt is 2a06:8187:fbab:2:9eeb:e8ff:fe20:92a2, length 32
13:42:22.007308 IP6 fe80::1441:95ff:fe40:f7dc > ff02::1:ff20:92a2: ICMP6, neighbor solicitation, who has 2a06:8187:fbab:2:9eeb:e8ff:fe20:92a2, length 32
13:42:22.007707 IP6 2a06:8187:fbab:2:9eeb:e8ff:fe20:92a2 > fe80::1441:95ff:fe40:f7dc: ICMP6, neighbor advertisement, tgt is 2a06:8187:fbab:2:9eeb:e8ff:fe20:92a2, length 32
13:42:27.008154 IP6 fe80::1441:95ff:fe40:f7dc > ff02::1:ff20:92a2: ICMP6, neighbor solicitation, who has 2a06:8187:fbab:2:9eeb:e8ff:fe20:92a2, length 32
13:42:27.008540 IP6 2a06:8187:fbab:2:9eeb:e8ff:fe20:92a2 > fe80::1441:95ff:fe40:f7dc: ICMP6, neighbor advertisement, tgt is 2a06:8187:fbab:2:9eeb:e8ff:fe20:92a2, length 32
13:42:32.008961 IP6 fe80::1441:95ff:fe40:f7dc > ff02::1:ff20:92a2: ICMP6, neighbor solicitation, who has 2a06:8187:fbab:2:9eeb:e8ff:fe20:92a2, length 32
13:42:32.009360 IP6 2a06:8187:fbab:2:9eeb:e8ff:fe20:92a2 > fe80::1441:95ff:fe40:f7dc: ICMP6, neighbor advertisement, tgt is 2a06:8187:fbab:2:9eeb:e8ff:fe20:92a2, length 32
13:42:37.009765 IP6 fe80::1441:95ff:fe40:f7dc > ff02::1:ff20:92a2: ICMP6, neighbor solicitation, who has 2a06:8187:fbab:2:9eeb:e8ff:fe20:92a2, length 32
13:42:37.010168 IP6 2a06:8187:fbab:2:9eeb:e8ff:fe20:92a2 > fe80::1441:95ff:fe40:f7dc: ICMP6, neighbor advertisement, tgt is 2a06:8187:fbab:2:9eeb:e8ff:fe20:92a2, length 32
13:42:42.010572 IP6 fe80::1441:95ff:fe40:f7dc > ff02::1:ff20:92a2: ICMP6, neighbor solicitation, who has 2a06:8187:fbab:2:9eeb:e8ff:fe20:92a2, length 32
13:42:42.010974 IP6 2a06:8187:fbab:2:9eeb:e8ff:fe20:92a2 > fe80::1441:95ff:fe40:f7dc: ICMP6, neighbor advertisement, tgt is 2a06:8187:fbab:2:9eeb:e8ff:fe20:92a2, length 32
13:42:42.018808 IP6 fe80::9eeb:e8ff:fe20:92a2 > fe80::1441:95ff:fe40:f7dc: ICMP6, neighbor solicitation, who has fe80::1441:95ff:fe40:f7dc, length 32
13:42:42.019061 IP6 fe80::1441:95ff:fe40:f7dc > fe80::9eeb:e8ff:fe20:92a2: ICMP6, neighbor advertisement, tgt is fe80::1441:95ff:fe40:f7dc, length 24
13:42:47.011393 IP6 fe80::1441:95ff:fe40:f7dc > ff02::1:ff20:92a2: ICMP6, neighbor solicitation, who has 2a06:8187:fbab:2:9eeb:e8ff:fe20:92a2, length 32
13:42:47.011787 IP6 2a06:8187:fbab:2:9eeb:e8ff:fe20:92a2 > fe80::1441:95ff:fe40:f7dc: ICMP6, neighbor advertisement, tgt is 2a06:8187:fbab:2:9eeb:e8ff:fe20:92a2, length 32
13:42:47.022745 IP6 fe80::1441:95ff:fe40:f7dc > fe80::9eeb:e8ff:fe20:92a2: ICMP6, neighbor solicitation, who has fe80::9eeb:e8ff:fe20:92a2, length 32
13:42:47.023100 IP6 fe80::9eeb:e8ff:fe20:92a2 > fe80::1441:95ff:fe40:f7dc: ICMP6, neighbor advertisement, tgt is fe80::9eeb:e8ff:fe20:92a2, length 24
13:42:52.012211 IP6 fe80::1441:95ff:fe40:f7dc > ff02::1:ff20:92a2: ICMP6, neighbor solicitation, who has 2a06:8187:fbab:2:9eeb:e8ff:fe20:92a2, length 32
13:42:52.012655 IP6 2a06:8187:fbab:2:9eeb:e8ff:fe20:92a2 > fe80::1441:95ff:fe40:f7dc: ICMP6, neighbor advertisement, tgt is 2a06:8187:fbab:2:9eeb:e8ff:fe20:92a2, length 32
13:42:57.015809 IP6 fe80::1441:95ff:fe40:f7dc > ff02::1:ff20:92a2: ICMP6, neighbor solicitation, who has 2a06:8187:fbab:2:9eeb:e8ff:fe20:92a2, length 32
13:42:57.016197 IP6 2a06:8187:fbab:2:9eeb:e8ff:fe20:92a2 > fe80::1441:95ff:fe40:f7dc: ICMP6, neighbor advertisement, tgt is 2a06:8187:fbab:2:9eeb:e8ff:fe20:92a2, length 32
13:43:02.016670 IP6 fe80::1441:95ff:fe40:f7dc > ff02::1:ff20:92a2: ICMP6, neighbor solicitation, who has 2a06:8187:fbab:2:9eeb:e8ff:fe20:92a2, length 32
13:43:02.017070 IP6 2a06:8187:fbab:2:9eeb:e8ff:fe20:92a2 > fe80::1441:95ff:fe40:f7dc: ICMP6, neighbor advertisement, tgt is 2a06:8187:fbab:2:9eeb:e8ff:fe20:92a2, length 32
13:43:07.017480 IP6 fe80::1441:95ff:fe40:f7dc > ff02::1:ff20:92a2: ICMP6, neighbor solicitation, who has 2a06:8187:fbab:2:9eeb:e8ff:fe20:92a2, length 32
13:43:07.017869 IP6 2a06:8187:fbab:2:9eeb:e8ff:fe20:92a2 > fe80::1441:95ff:fe40:f7dc: ICMP6, neighbor advertisement, tgt is 2a06:8187:fbab:2:9eeb:e8ff:fe20:92a2, length 32
13:43:12.018288 IP6 fe80::1441:95ff:fe40:f7dc > ff02::1:ff20:92a2: ICMP6, neighbor solicitation, who has 2a06:8187:fbab:2:9eeb:e8ff:fe20:92a2, length 32
13:43:12.018685 IP6 2a06:8187:fbab:2:9eeb:e8ff:fe20:92a2 > fe80::1441:95ff:fe40:f7dc: ICMP6, neighbor advertisement, tgt is 2a06:8187:fbab:2:9eeb:e8ff:fe20:92a2, length 32
`

**Comment by christf** [comment]
and again same situation (connecting a client to the switch) with igmp_snooping=0 on br-client:

` ./tcpdump  -p -i br-client
tcpdump: WARNING: br-client: no IPv4 address assigned
tcpdump: verbose output suppressed, use -v or -vv for full protocol decode
listening on br-client, link-type EN10MB (Ethernet), capture size 65535 bytes
[ 1963.740000] eth0: link up (1000Mbps/Full duplex)
[ 1963.740000] br-client: port 1(eth0) entered forwarding state
[ 1963.750000] br-client: port 1(eth0) entered forwarding state
13:46:58.941963 IP6 :: > ff02::16: HBH ICMP6, multicast listener report v2, 1 group record(s), length 28
13:46:59.181976 IP6 fe80::9eeb:e8ff:fe20:92a2 > ff02::16: HBH ICMP6, multicast listener report v2, 1 group record(s), length 28
13:46:59.185618 IP6 fe80::9eeb:e8ff:fe20:92a2 > ff02::2: ICMP6, router solicitation, length 8
13:46:59.189935 IP6 fe80::9eeb:e8ff:fe20:92a2 > ff02::16: HBH ICMP6, multicast listener report v2, 1 group record(s), length 28
13:46:59.285123 IP6 fe80::9eeb:e8ff:fe20:92a2.mdns > ff02::fb.mdns: 0 [2q] PTR (QM)? _ipps._tcp.local. PTR (QM)? _ipp._tcp.local. (45)
13:46:59.321928 IP6 fe80::9eeb:e8ff:fe20:92a2 > ff02::16: HBH ICMP6, multicast listener report v2, 1 group record(s), length 28
13:46:59.357903 IP6 fe80::9eeb:e8ff:fe20:92a2 > ff02::16: HBH ICMP6, multicast listener report v2, 2 group record(s), length 48
13:46:59.372440 IP6 fe80::9eeb:e8ff:fe20:92a2.mdns > ff02::fb.mdns: 0 [3q] [5n] ANY (QM)? yoshi [9c:eb:e8:20:92:a2]._workstation._tcp.local. ANY (QM)? yoshi.local. ANY (QM)? 2.a.2.9.0.2.e.f.f.f.8.e.b.e.e.9.0.0.0.0.0.0.0.0.0.0.0.0.0.8.e.f.ip6.arpa. (257)
13:46:59.397816 IP6 fe80::9eeb:e8ff:fe20:92a2.mdns > ff02::fb.mdns: 0*- [0q] 2/0/0 PTR _workstation._tcp.local., PTR yoshi [9c:eb:e8:20:92:a2]._workstation._tcp.local. (112)
[ 1965.750000] br-client: port 1(eth0) entered forwarding state
13:46:59.623599 IP6 fe80::9eeb:e8ff:fe20:92a2.mdns > ff02::fb.mdns: 0 [3q] [5n] ANY (QM)? yoshi [9c:eb:e8:20:92:a2]._workstation._tcp.local. ANY (QM)? yoshi.local. ANY (QM)? 2.a.2.9.0.2.e.f.f.f.8.e.b.e.e.9.0.0.0.0.0.0.0.0.0.0.0.0.0.8.e.f.ip6.arpa. (257)
13:46:59.649560 IP6 fe80::1441:95ff:fe40:f7dc > ff02::1: ICMP6, router advertisement, length 80
13:46:59.657930 IP6 fe80::9eeb:e8ff:fe20:92a2 > ff02::16: HBH ICMP6, multicast listener report v2, 2 group record(s), length 48
13:46:59.890649 IP6 fe80::9eeb:e8ff:fe20:92a2.mdns > ff02::fb.mdns: 0 [3q] [5n] ANY (QM)? yoshi [9c:eb:e8:20:92:a2]._workstation._tcp.local. ANY (QM)? yoshi.local. ANY (QM)? 2.a.2.9.0.2.e.f.f.f.8.e.b.e.e.9.0.0.0.0.0.0.0.0.0.0.0.0.0.8.e.f.ip6.arpa. (257)
13:47:00.091346 IP6 fe80::9eeb:e8ff:fe20:92a2.mdns > ff02::fb.mdns: 0*- [0q] 5/0/0 (Cache flush) TXT "", (Cache flush) AAAA fe80::9eeb:e8ff:fe20:92a2, (Cache flush) PTR yoshi.local., (Cache flush) HINFO, (Cache flush) SRV yoshi.local.:9 0 0 (239)
13:47:00.245934 IP6 fe80::9eeb:e8ff:fe20:92a2 > ff02::16: HBH ICMP6, multicast listener report v2, 2 group record(s), length 48
13:47:00.285744 IP6 fe80::9eeb:e8ff:fe20:92a2.mdns > ff02::fb.mdns: 0 [2q] PTR (QM)? _ipps._tcp.local. PTR (QM)? _ipp._tcp.local. (45)
13:47:00.534266 IP6 fe80::9eeb:e8ff:fe20:92a2.mdns > ff02::fb.mdns: 0*- [0q] 2/0/0 PTR _workstation._tcp.local., PTR yoshi [9c:eb:e8:20:92:a2]._workstation._tcp.local. (112)
13:47:00.614039 IP6 :: > ff02::1:ff20:92a2: ICMP6, neighbor solicitation, who has 2a06:8187:fbab:2:9eeb:e8ff:fe20:92a2, length 24
13:47:00.726159 IP6 fe80::9eeb:e8ff:fe20:92a2.50829 > nextnode.domain: 4056+ SOA? local. (23)
13:47:00.774271 IP6 nextnode.domain > fe80::9eeb:e8ff:fe20:92a2.50829: 4056 NXDomain 0/1/0 (98)
13:47:01.228537 IP6 fe80::9eeb:e8ff:fe20:92a2.mdns > ff02::fb.mdns: 0*- [0q] 5/0/0 (Cache flush) TXT "", (Cache flush) AAAA fe80::9eeb:e8ff:fe20:92a2, (Cache flush) PTR yoshi.local., (Cache flush) HINFO, (Cache flush) SRV yoshi.local.:9 0 0 (239)
13:47:01.616685 IP6 2a06:8187:fbab:2:9eeb:e8ff:fe20:92a2.mdns > ff02::fb.mdns: 0*- [0q] 2/0/0 (Cache flush) PTR yoshi.local., (Cache flush) AAAA fe80::9eeb:e8ff:fe20:92a2 (137)
13:47:01.621894 IP6 fe80::9eeb:e8ff:fe20:92a2 > ff02::16: HBH ICMP6, multicast listener report v2, 1 group record(s), length 28
13:47:01.773913 IP6 fe80::9eeb:e8ff:fe20:92a2 > ff02::16: HBH ICMP6, multicast listener report v2, 1 group record(s), length 28
13:47:01.803170 IP6 2a06:8187:fbab:2:9eeb:e8ff:fe20:92a2.mdns > ff02::fb.mdns: 0 [2q] [2n] ANY (QM)? 2.a.2.9.0.2.e.f.f.f.8.e.b.e.e.9.2.0.0.0.b.a.b.f.7.8.1.8.6.0.a.2.ip6.arpa. ANY (QM)? yoshi.local. (149)
13:47:01.803316 IP6 2a06:8187:fbab:2:9eeb:e8ff:fe20:92a2.mdns > ff02::fb.mdns: 0*- [0q] 1/0/0 (Cache flush) HINFO (48)
13:47:02.053820 IP6 2a06:8187:fbab:2:9eeb:e8ff:fe20:92a2.mdns > ff02::fb.mdns: 0 [2q] [2n] ANY (QM)? 2.a.2.9.0.2.e.f.f.f.8.e.b.e.e.9.2.0.0.0.b.a.b.f.7.8.1.8.6.0.a.2.ip6.arpa. ANY (QM)? yoshi.local. (149)
13:47:02.286665 IP6 2a06:8187:fbab:2:9eeb:e8ff:fe20:92a2.mdns > ff02::fb.mdns: 0 [2q] PTR (QM)? _ipps._tcp.local. PTR (QM)? _ipp._tcp.local. (45)
13:47:02.304929 IP6 2a06:8187:fbab:2:9eeb:e8ff:fe20:92a2.mdns > ff02::fb.mdns: 0 [2q] [2n] ANY (QM)? 2.a.2.9.0.2.e.f.f.f.8.e.b.e.e.9.2.0.0.0.b.a.b.f.7.8.1.8.6.0.a.2.ip6.arpa. ANY (QM)? yoshi.local. (149)
13:47:02.305054 IP6 2a06:8187:fbab:2:9eeb:e8ff:fe20:92a2.mdns > ff02::fb.mdns: 0*- [0q] 1/0/0 (Cache flush) HINFO (48)
13:47:02.505576 IP6 2a06:8187:fbab:2:9eeb:e8ff:fe20:92a2.mdns > ff02::fb.mdns: 0*- [0q] 2/0/0 (Cache flush) PTR yoshi.local., (Cache flush) AAAA 2a06:8187:fbab:2:9eeb:e8ff:fe20:92a2 (137)
13:47:02.671364 IP6 2a06:8187:fbab:2:9eeb:e8ff:fe20:92a2.mdns > ff02::fb.mdns: 0*- [0q] 4/0/0 PTR _workstation._tcp.local., PTR yoshi [9c:eb:e8:20:92:a2]._workstation._tcp.local., (Cache flush) TXT "", (Cache flush) SRV yoshi.local.:9 0 0 (151)
13:47:03.365466 IP6 2a06:8187:fbab:2:9eeb:e8ff:fe20:92a2.mdns > ff02::fb.mdns: 0*- [0q] 4/0/0 (Cache flush) TXT "", (Cache flush) HINFO, (Cache flush) SRV yoshi.local.:9 0 0, (Cache flush) AAAA 2a06:8187:fbab:2:9eeb:e8ff:fe20:92a2 (153)
13:47:03.642959 IP6 2a06:8187:fbab:2:9eeb:e8ff:fe20:92a2.mdns > ff02::fb.mdns: 0*- [0q] 1/0/0 (Cache flush) PTR yoshi.local. (109)
`

**Comment by christf** [comment]
this time with snooping=1 and full packet capture on eth0 and br-client.
mind: these are captures, not png files.

![snooping1_br-client cap](https://cloud.githubusercontent.com/assets/4321652/20865834/ddf0d6c8-ba1c-11e6-899b-aed488e6f79a.png)
![snooping1_eth0 cap](https://cloud.githubusercontent.com/assets/4321652/20865835/ddf33166-ba1c-11e6-84ac-52e89c331ff6.png)

**Comment by christf** [comment]
![snooping0_eth0 cap](https://cloud.githubusercontent.com/assets/4321652/21370278/400e81e8-c70b-11e6-91d9-4926eb35cd24.png)
![snooping0_br-client cap](https://cloud.githubusercontent.com/assets/4321652/21370279/40108f2e-c70b-11e6-9f84-6b9417c4a03a.png)

**Comment by christf** [comment]
![snooping0_mcrouter2_eth0 cap](https://cloud.githubusercontent.com/assets/4321652/21370710/66104e9c-c70d-11e6-85a1-05d2578a0849.png)
![snooping0_mcrouter2_br-client cap](https://cloud.githubusercontent.com/assets/4321652/21370709/660c4da6-c70d-11e6-9ecb-4896606e26b6.png)

**Comment by christf** [comment]
apparently snooping=1 and multicast_router=2 also results in clients obtaining IP addresses quickly so th is what I am setting in the babel PR for improved airtime.

**Comment by christf** [comment]
@T-X what should we do with this?

**Comment by rotanid** [comment]
its been another 17 months, whats the status here @T-X @christf  ?

**Comment by mweinelt** [comment]
Another 12.5 months … @christf?
